{
  "$schema": "https://json-schema.org/draft/2020-12/schema",
  "$id": "https://sister.local/contracts/system_manifest.schema.json",
  "title": "SisTer System Manifest",
  "type": "object",
  "required": [
    "system_id",
    "system_name",
    "system_version",
    "contract_version",
    "type",
    "domain",
    "operational_mode",
    "exports",
    "integration_modes",
    "access",
    "sharing_policy",
    "data_policy"
  ],
  "properties": {
    "system_id": { "type": "string", "minLength": 1 },
    "system_name": { "type": "string", "minLength": 1 },
    "system_version": { "type": "string", "minLength": 1 },
    "contract_version": { "type": "string", "minLength": 1 },
    "governance_contract": { "type": "string", "minLength": 1 },
    "type": { "type": "string", "minLength": 1 },
    "domain": { "type": "array", "items": { "type": "string" }, "minItems": 1 },
    "operational_mode": { "type": "array", "items": { "type": "string" }, "minItems": 1 },
    "exports": { "type": "array", "items": { "type": "string" }, "minItems": 1 },
    "integration_modes": { "type": "array", "items": { "type": "string" }, "minItems": 1 },
    "responsible_repository": { "type": "string" },
    "access": {
      "type": "object",
      "required": ["platform_url", "access_mode"],
      "properties": {
        "platform_url": { "type": "string", "minLength": 1 },
        "access_label": { "type": "string" },
        "access_mode": {
          "enum": ["public_link", "restricted_link", "local_network", "offline_reference", "not_available"]
        }
      }
    },
    "sharing_policy": {
      "type": "object",
      "required": ["shareable_with_sister", "native_to_system", "public_outputs", "restricted_outputs", "private_outputs", "sensitive_topics", "dikw_role"],
      "properties": {
        "shareable_with_sister": {
          "type": "array",
          "items": { "type": "string" }
        },
        "native_to_system": {
          "type": "array",
          "items": { "type": "string" }
        },
        "public_outputs": {
          "type": "array",
          "items": { "type": "string" }
        },
        "restricted_outputs": {
          "type": "array",
          "items": { "type": "string" }
        },
        "private_outputs": {
          "type": "array",
          "items": { "type": "string" }
        },
        "sensitive_topics": {
          "type": "array",
          "items": { "type": "string" }
        },
        "dikw_role": {
          "type": "object",
          "required": ["offers_as_information", "received_by_sister_as", "sister_transforms_into"],
          "properties": {
            "offers_as_information": {
              "type": "array",
              "items": { "type": "string" }
            },
            "received_by_sister_as": {
              "enum": ["data"]
            },
            "sister_transforms_into": {
              "type": "array",
              "items": {
                "enum": ["information", "knowledge", "wisdom"]
              },
              "minItems": 1
            }
          }
        }
      }
    },
    "data_policy": {
      "type": "object",
      "required": ["requires_provenance", "requires_schema_validation"],
      "properties": {
        "requires_provenance": { "const": true },
        "allows_offline_sync": { "type": "boolean" },
        "requires_schema_validation": { "const": true },
        "requires_operator": { "type": "boolean" },
        "requires_spatial_reference": { "type": "boolean" },
        "requires_authenticated_access": { "type": "boolean" },
        "requires_attribution": { "type": "boolean" },
        "commercial_use_allowed": { "type": "boolean" }
      }
    }
  }
}
